{
  "$schema": "https://json-schema.org/draft/2020-12/schema",
  "$id": "https://schemas.nestor.local/docker/1.0/execution-report.schema.json",
  "title": "Nestor Docker execution report",
  "description": "Resultado honesto e rastreável da execução",
  "type": "object",
  "properties": {
    "schema_version": {
      "const": "1.0"
    },
    "task_id": {
      "type": "string",
      "minLength": 1
    },
    "objective": {
      "type": "string",
      "minLength": 1
    },
    "environment": {
      "type": "string",
      "enum": [
        "dev",
        "test",
        "homolog",
        "prod",
        "unknown"
      ]
    },
    "docker_context": {
      "type": [
        "string",
        "null"
      ]
    },
    "status": {
      "type": "string",
      "enum": [
        "verified",
        "partial",
        "blocked",
        "not_verified"
      ]
    },
    "diagnosis": {
      "type": "string"
    },
    "root_cause": {
      "type": [
        "string",
        "null"
      ]
    },
    "evidence": {
      "type": "array",
      "items": {
        "type": "object",
        "properties": {
          "label": {
            "type": "string",
            "enum": [
              "FACT",
              "INFERENCE",
              "HYPOTHESIS",
              "UNKNOWN"
            ]
          },
          "statement": {
            "type": "string",
            "minLength": 1
          },
          "source": {
            "type": [
              "string",
              "null"
            ]
          },
          "collected_at": {
            "type": [
              "string",
              "null"
            ],
            "format": "date-time"
          },
          "context": {
            "type": [
              "string",
              "null"
            ]
          },
          "confidence": {
            "type": "string",
            "enum": [
              "confirmed",
              "probable",
              "uncertain",
              "not_assessed"
            ]
          }
        },
        "required": [
          "label",
          "statement",
          "confidence"
        ],
        "additionalProperties": false
      }
    },
    "files_changed": {
      "type": "array",
      "items": {
        "type": "string"
      }
    },
    "operational_actions": {
      "type": "array",
      "items": {
        "type": "string"
      }
    },
    "impact": {
      "type": "string"
    },
    "persistence_security": {
      "type": "string"
    },
    "tests": {
      "type": "array",
      "items": {
        "type": "object",
        "properties": {
          "name": {
            "type": "string",
            "minLength": 1
          },
          "status": {
            "type": "string",
            "enum": [
              "passed",
              "failed",
              "blocked",
              "not_run",
              "inconclusive"
            ]
          },
          "evidence": {
            "type": [
              "string",
              "null"
            ]
          },
          "reason": {
            "type": [
              "string",
              "null"
            ]
          }
        },
        "required": [
          "name",
          "status"
        ],
        "additionalProperties": false
      }
    },
    "risks": {
      "type": "array",
      "items": {
        "type": "object",
        "properties": {
          "description": {
            "type": "string",
            "minLength": 1
          },
          "severity": {
            "type": "string",
            "enum": [
              "low",
              "medium",
              "high",
              "critical",
              "unknown"
            ]
          },
          "mitigation": {
            "type": [
              "string",
              "null"
            ]
          }
        },
        "required": [
          "description",
          "severity"
        ],
        "additionalProperties": false
      }
    },
    "rollback": {
      "type": [
        "string",
        "null"
      ]
    },
    "pending": {
      "type": "array",
      "items": {
        "type": "string"
      }
    },
    "next_steps": {
      "type": "array",
      "items": {
        "type": "string"
      }
    }
  },
  "required": [
    "schema_version",
    "task_id",
    "objective",
    "environment",
    "status",
    "diagnosis",
    "evidence",
    "files_changed",
    "operational_actions",
    "impact",
    "persistence_security",
    "tests",
    "risks",
    "pending",
    "next_steps"
  ],
  "additionalProperties": false
}
