{
  "schema_version": "1.0",
  "task_id": "example-docker-001",
  "objective": "Demonstrar relatório de triagem sem acesso real",
  "environment": "homolog",
  "docker_context": "homolog-remote",
  "status": "not_verified",
  "diagnosis": "Exemplo hipotético: nenhum comando foi executado; causa não verificada",
  "root_cause": null,
  "evidence": [
    {
      "label": "UNKNOWN",
      "statement": "Causa dos reinícios não determinada neste exemplo",
      "source": null,
      "collected_at": null,
      "context": "Exemplo fictício, sem acesso a ambiente",
      "confidence": "not_assessed"
    }
  ],
  "files_changed": [],
  "operational_actions": [],
  "impact": "Nenhum: este arquivo é um exemplo, não uma execução real",
  "persistence_security": "Não foram realizados acessos a dados ou secrets",
  "tests": [{"name": "Consulta do estado do serviço", "status": "not_run", "evidence": null, "reason": "Exemplo documental"}],
  "risks": [{"description": "Informação insuficiente para correção", "severity": "unknown", "mitigation": "Coletar status e logs redigidos no ambiente autorizado"}],
  "rollback": null,
  "pending": ["Confirmar contexto e coletar evidências"],
  "next_steps": ["Executar triagem de leitura com autorização e ambiente definidos"]
}
